001:006:002:DESCRIPTOR         1660224882.519133
 06 A0 FF 09 01 A1 01 85 01 09 02 15 00 25 FF 75
 08 95 07 81 02 15 00 25 01 95 40 75 01 05 08 19
 01 29 40 91 02 09 00 15 00 26 FF 00 75 08 95 07
 85 08 B1 02 C0 05 01 09 06 A1 01 85 02 05 07 19
 E0 29 E7 15 00 25 01 75 01 95 08 81 02 95 01 75
 08 81 01 95 05 75 01 05 08 19 01 29 05 91 02 95
 01 75 03 91 01 95 05 75 08 15 00 25 65 05 07 19
 00 29 65 81 00 C0 05 0D 09 01 A1 01 85 05 09 20
 A1 00 09 42 09 44 09 45 09 3C 15 00 25 01 75 01
 95 04 81 02 75 01 95 02 81 01 09 32 75 01 95 01
 81 02 81 01 05 01 09 30 75 10 95 01 A4 55 0D 65
 13 35 00 46 40 1F 26 00 10 81 02 09 31 46 DC 14
 26 00 10 81 02 B4 05 0D 09 30 26 FF 07 46 FF 07
 55 00 66 11 E1 75 10 81 02 C0 C0 05 0C 09 01 A1
 01 85 04 19 00 2A 3C 02 15 00 26 3C 02 95 01 75
 10 81 00 C0 05 0D 09 02 A1 01 85 07 09 20 A1 00
 09 42 09 44 09 45 09 3C 09 43 09 44 15 00 25 01
 75 01 95 06 81 02 09 32 75 01 95 01 81 02 81 03
 05 01 09 30 09 31 55 0D 65 33 26 00 10 35 00 46
 40 1F 75 10 95 02 81 02 05 0D 09 30 46 FF 1F 26
 FF 07 75 10 95 01 81 02 C0 C0

001:006:001:DESCRIPTOR         1660224882.531277
 06 A0 FF 09 01 A1 01 85 06 95 08 75 3F 15 00 26
 FF 00 09 01 19 00 2A FF 00 81 00 C0 05 01 09 02
 A1 01 85 03 09 01 A1 00 05 09 19 01 29 08 15 00
 25 01 95 08 75 01 81 02 05 01 15 81 25 7F 75 08
 95 03 09 30 09 31 09 38 81 06 C0 C0

